{
  "ticker": "AAPL",
  "output_mode": "C",
  "run_context": {
    "run_id": "20260328T000000Z_AAPL_C",
    "ticker": "AAPL",
    "artifact_root": "output/runs/20260328T000000Z_AAPL_C/AAPL"
  },
  "quality_report_path": "/tmp/aapl-quality-report-with-critic.json",
  "analysis_result_path": "output/runs/20260328T000000Z_AAPL_C/AAPL/analysis-result.json",
  "report_output_path": "output/reports/AAPL_C_EN_2026-03-28.html",
  "critic_overall": "FAIL",
  "current_recheck_count": 0,
  "remaining_recheck_budget": 1,
  "pending_fix_count": 1,
  "ready_for_redelivery": false,
  "loop_state": "patch_and_recheck",
  "tasks": [
    {
      "task_id": "01_mechanism_test",
      "priority": 1,
      "source_item": "mechanism_test",
      "section": "Section 5 — Precision Risk",
      "problem": "Regulatory risk lacks quantified stock-price transmission.",
      "requested_fix": "Add the revenue, EBITDA, and multiple-compression chain for the downside case.",
      "analysis_targets": [
        "sections.precision_risks"
      ],
      "report_targets": [
        "Section 5 — Precision Risk"
      ],
      "edit_scope": "analysis_json_and_render",
      "render_step_required": true,
      "notes": [
        "Patch only the failing section; preserve all previously passing critic items."
      ]
    }
  ]
}